{
  "$schema": "http://json-schema.org/draft-06/schema#",
  "id": "http://hl7.org/fhir/json-schema/DocumentReference",
  "description": "A reference to a document of any kind for any purpose. Provides metadata about the document so that the document can be discovered and managed. The scope of a document is any seralized object with a mime-type, so includes formal patient centric documents (CDA), clinical notes, scanned paper, and non-patient specific documents like policy text.",
  "type": "object",
  "required": ["resourceType", "content"],
  "properties": {
    "resourceType": { "const": "DocumentReference" },
    "id": { "type": "string", "description": "Logical id of this artifact" },
    "_id": { "type": "string", "description": "MongoDB primary key" },
    "meta": { "type": "object", "properties": { "versionId": { "type": "string" }, "lastUpdated": { "type": "string" }, "source": { "type": "string" }, "profile": { "type": "array", "items": { "type": "string" } }, "security": { "type": "array", "items": { "type": "object", "properties": { "system": { "type": "string" }, "code": { "type": "string" }, "display": { "type": "string" } } } }, "tag": { "type": "array", "items": { "type": "object", "properties": { "system": { "type": "string" }, "code": { "type": "string" }, "display": { "type": "string" } } } } } },
    "implicitRules": { "type": "string" },
    "language": { "type": "string" },
    "text": { "type": "object", "properties": { "status": { "type": "string" }, "div": { "type": "string" } } },
    "contained": { "type": "array", "items": { "type": "object" } },
    "extension": { "type": "array", "items": { "type": "object" } },
    "modifierExtension": { "type": "array", "items": { "type": "object" } },
    "masterIdentifier": { "type": "object", "properties": { "use": { "type": "string" }, "system": { "type": "string" }, "value": { "type": "string" } } },
    "identifier": { "type": "array", "items": { "type": "object", "properties": { "use": { "type": "string" }, "system": { "type": "string" }, "value": { "type": "string" } } } },
    "status": { "type": "string", "enum": ["current", "superseded", "entered-in-error"] },
    "docStatus": { "type": "string", "enum": ["preliminary", "final", "amended", "entered-in-error"] },
    "type": { "type": "object", "properties": { "coding": { "type": "array", "items": { "type": "object", "properties": { "system": { "type": "string" }, "code": { "type": "string" }, "display": { "type": "string" } } } }, "text": { "type": "string" } } },
    "category": { "type": "array", "items": { "type": "object", "properties": { "coding": { "type": "array", "items": { "type": "object", "properties": { "system": { "type": "string" }, "code": { "type": "string" }, "display": { "type": "string" } } } }, "text": { "type": "string" } } } },
    "subject": { "type": "object", "properties": { "reference": { "type": "string" }, "display": { "type": "string" } } },
    "date": { "type": "string" },
    "author": { "type": "array", "items": { "type": "object", "properties": { "reference": { "type": "string" }, "display": { "type": "string" } } } },
    "authenticator": { "type": "object", "properties": { "reference": { "type": "string" }, "display": { "type": "string" } } },
    "custodian": { "type": "object", "properties": { "reference": { "type": "string" }, "display": { "type": "string" } } },
    "relatesTo": { "type": "array", "items": { "type": "object", "properties": { "code": { "type": "string", "enum": ["replaces", "transforms", "signs", "appends"] }, "target": { "type": "object", "properties": { "reference": { "type": "string" }, "display": { "type": "string" } } } } } },
    "description": { "type": "string" },
    "securityLabel": { "type": "array", "items": { "type": "object", "properties": { "coding": { "type": "array", "items": { "type": "object", "properties": { "system": { "type": "string" }, "code": { "type": "string" }, "display": { "type": "string" } } } }, "text": { "type": "string" } } } },
    "content": { "type": "array", "items": { "type": "object", "properties": { "attachment": { "type": "object", "properties": { "contentType": { "type": "string" }, "language": { "type": "string" }, "data": { "type": "string" }, "url": { "type": "string" }, "size": { "type": "integer" }, "hash": { "type": "string" }, "title": { "type": "string" }, "creation": { "type": "string" } } }, "format": { "type": "object", "properties": { "system": { "type": "string" }, "code": { "type": "string" }, "display": { "type": "string" } } } } } },
    "context": { "type": "object", "properties": { "encounter": { "type": "array", "items": { "type": "object", "properties": { "reference": { "type": "string" }, "display": { "type": "string" } } } }, "event": { "type": "array", "items": { "type": "object", "properties": { "coding": { "type": "array", "items": { "type": "object", "properties": { "system": { "type": "string" }, "code": { "type": "string" }, "display": { "type": "string" } } } }, "text": { "type": "string" } } } }, "period": { "type": "object", "properties": { "start": { "type": "string" }, "end": { "type": "string" } } }, "facilityType": { "type": "object", "properties": { "coding": { "type": "array", "items": { "type": "object", "properties": { "system": { "type": "string" }, "code": { "type": "string" }, "display": { "type": "string" } } } }, "text": { "type": "string" } } }, "practiceSetting": { "type": "object", "properties": { "coding": { "type": "array", "items": { "type": "object", "properties": { "system": { "type": "string" }, "code": { "type": "string" }, "display": { "type": "string" } } } }, "text": { "type": "string" } } }, "sourcePatientInfo": { "type": "object", "properties": { "reference": { "type": "string" }, "display": { "type": "string" } } }, "related": { "type": "array", "items": { "type": "object", "properties": { "reference": { "type": "string" }, "display": { "type": "string" } } } } } }
  }
}
