{
  "resourceType": "DocumentReference",
  "id": "bsj-adi-001",
  "meta": {
    "profile": ["http://hl7.org/fhir/us/pacio-adi/StructureDefinition/ADI-DocumentReference"]
  },
  "status": "current",
  "type": {
    "coding": [{
      "system": "http://loinc.org",
      "code": "75320-2",
      "display": "Advance Directive"
    }]
  },
  "category": [{
    "coding": [{
      "system": "http://hl7.org/fhir/us/core/CodeSystem/us-core-documentreference-category",
      "code": "clinical-note",
      "display": "Clinical Note"
    }]
  }],
  "subject": {
    "reference": "Patient/bsj-patient-001",
    "display": "Betsy Smith-Johnson"
  },
  "date": "2025-06-15T14:00:00Z",
  "author": [{
    "reference": "Patient/bsj-patient-001",
    "display": "Betsy Smith-Johnson"
  }],
  "description": "Betsy Smith-Johnson's Advance Directive - Living Will and Healthcare Proxy designation",
  "content": [{
    "attachment": {
      "contentType": "application/pdf", "data": "JVBERi0xLjEKMSAwIG9iajw8L1R5cGUvQ2F0YWxvZy9QYWdlcyAyIDAgUj4+ZW5kb2JqCjIgMCBvYmo8PC9UeXBlL1BhZ2VzL0tpZHNbMyAwIFJdL0NvdW50IDE+PmVuZG9iagozIDAgb2JqPDwvVHlwZS9QYWdlL1BhcmVudCAyIDAgUi9NZWRpYUJveFswIDAgNjEyIDc5Ml0+PmVuZG9iagp4cmVmCjAgNAowMDAwMDAwMDAwIDY1NTM1IGYgCnRyYWlsZXI8PC9TaXplIDQvUm9vdCAxIDAgUj4+CnN0YXJ0eHJlZgowCiUlRU9GCg==",
      "title": "Advance Directive Document",
      "creation": "2025-06-15T14:00:00Z"
    }
  }]
}
